{"attempt":1,"effort":"low","exactModel":"gpt-5.6-sol","launchDigest":"sha256:aaaaaaaaaaaaaaaaaaaaaaaaaaaaaaaaaaaaaaaaaaaaaaaaaaaaaaaaaaaaaaaa","observed":true,"runId":"cb-20260901-0123456789abcdef","schemaVersion":"compass-builder.worker-usage.v1","source":"codex-exec-jsonl-stdout","storyId":"alpha","terminalStatus":"succeeded","unavailableReason":null,"usage":{"cacheWriteInputTokens":0,"cacheWriteInputTokensPresent":false,"cachedInputTokens":40,"inputTokens":100,"outputTokens":20,"reasoningOutputTokens":5},"workerReceiptDigest":null}
